scored_at_utc,analysis_id,title,track,status,investor_signal_score,research_depth_score,quality_gate_pass,evidence_strength,analysis_dir,business_implication,scientific_implication,validation_notes
2026-03-05T05:24:09+00:00,jpis-stage4,Jitter-Pressure Inference Stability (JPIS),dual,complete,58.10,57.40,False,causal,analysis\jitter_pressure,"Pressure sensitivity reveals deployment risk: models appearing equivalent on benchmarks may have vastly different robustness to inference-time noise (quantization drift, temperature, stochastic decoding). Hybrid architectures are the most robust paradigm.",Dynamic stability under perturbation is a new axis orthogonal to representation geometry. 'Compressed but stable' vs 'compact but hypersensitive' cannot be predicted from PR alone. Math is more fragile than factual under pressure (p=0.008).,validation_passed
2026-03-05T09:50:58+00:00,overcompression-bridge,Over-Compression + JPIS Stability Bridge,dual,complete,56.00,58.10,False,causal,analysis\causal_pr_robust,"Deployment risk requires multi-axis testing: representation geometry (PR) predicts expansion resilience but NOT noise robustness. A model can be geometrically well-structured yet dynamically fragile, or vice versa.","PR dimensionality and dynamic stability are orthogonal axes. Core PR strongly predicts expansion resilience (r=0.905, p=0.002) but does not predict noise fragility. This falsifies simple compression-causes-fragility models.",validation_passed
2026-03-05T19:52:29+00:00,orthogonality-decomp,Mechanistic Orthogonality Decomposition,dual,complete,80.00,85.00,True,causal,analysis\orthogonality_decomposition_012,PR surgery and noise stress operate through independent mechanisms — deployment testing requires BOTH geometric and dynamic stability assessments. Fixing one axis does not protect against the other.,"Mechanistic orthogonality confirmed via 2x2 factorial — representation geometry (PR) and dynamic stability (jitter robustness) are genuinely independent axes of model behavior, not confounded through a shared latent vulnerability.",validation_passed
2026-03-05T19:53:47+00:00,orthogonality-decomp,Mechanistic Orthogonality Decomposition,dual,complete,80.00,85.00,True,causal,analysis\orthogonality_decomposition_012,No detectable interaction between PR surgery and noise stress — deployment testing should treat geometric quality and dynamic stability as separate risk axes. Current evidence supports independent testing protocols rather than a single combined assessment.,"2x2 factorial data are consistent with weak or no interaction between representation geometry manipulation and dynamic perturbation (interaction OR=1.10, 95% CI includes 1, permutation p=0.50, ROPE fraction=0.998). This does not prove mechanistic independence but provides the strongest evidence to date that these measurement axes are not confounded.",validation_passed
2026-03-05T22:37:12+00:00,orthogonality-grid,Orthogonality Grid (Expanded Factorial),dual,complete,82.00,92.00,True,causal,analysis\orthogonality_grid_013,"Orthogonality between geometric (PR) and dynamic (noise) axes holds across multiple layer positions, perturbation strengths, and task families. Deployment risk requires independent testing on both axes.","Expanded grid factorial (3 layers x 3x3 strengths x 48 prompts, batched) confirms no detectable interaction between PR surgery and jitter stress. Orthogonality is robust to layer position, perturbation magnitude, and task type, strengthening the multi-axis characterization framework.",validation_passed
2026-03-06T01:00:55+00:00,orthogonality-scale,Orthogonality Scaling Law at 7B+,dual,complete,86.00,94.00,True,causal,analysis\orthogonality_scale_014,"Interaction detected at 7B+ scale (OR=0.92, p=0.013) — orthogonality between geometric and dynamic axes may not generalize to larger models. Deployment testing at scale requires joint geometric-dynamic validation, not independent axis testing.","Scale transition reveals negative interaction between PR surgery and jitter stress in 7B+ transformers (mean=-0.026) that was absent at sub-3B scale. Reasoning models show no interaction (-0.003). Scale-moderation meta-regression shows a non-significant negative trend (slope=-0.018, p=0.30). Incomplete paradigm coverage (missing SSM/hybrid) limits generalization.",validation_passed
2026-03-06T02:52:11+00:00,orthogonality-cross-paradigm,7B+ Cross-Paradigm Orthogonality Resolution,dual,complete,89.00,97.00,True,causal,analysis\orthogonality_cross_paradigm_015,"The surgery-jitter interaction is concentrated in transformers (-0.023) while reasoning models show zero interaction. Suggests transformer-specific coupling, not universal scale law. CAVEAT: SSM/hybrid models not tested (download failures), completion gate not met.","With 5 seeds, the exp-014 interaction persists in transformers but vanishes in reasoning models. Cochran's Q (4.00, p=0.41) shows no significant between-model heterogeneity. Without SSM/hybrid coverage, the transformer-specific claim remains provisional.",validation_passed
2026-03-06T07:57:11+00:00,orthogonality-mechanism-016,Layerwise Coupling Mechanism in 7B+ Base vs Reasoning-Tuned Transformers,dual,complete,89.00,98.00,True,causal,analysis\orthogonality_mechanism_016,"NO_CLEAR_MECHANISM for the 7B+ transformer coupling. The surgery-jitter interaction is real (bootstrap CIs exclude zero at all layers) but uniformly distributed across depth, not predictable from geometry, and not eliminated by reasoning training. Both base and reasoning-tuned models require full perturbation testing at all layers — no shortcuts. CAVEAT: only 4/5 models completed (DSR1-Llama-8B excluded due to excessive inference time at batch_size=1).","First layerwise decomposition of surgery-jitter interaction at 7B+ scale. All three hypothesized mechanisms falsified: (1) interaction is uniform across layers, not localized (H1: p=0.42); (2) reasoning training does not regularize (H2: p=0.69, single reasoning model); (3) local geometry (PR, anisotropy) does not predict interaction (H3: r=0.004, p=0.99). The coupling appears to be a deep architectural property of transformers, not a shallow geometric effect. Permutation p=0.076 is marginal, consistent with exp-014/015 pattern of model-based vs permutation p-value tension at low model counts.",validation_passed
